title,abuseReported,rating,location_,userid,productid,reviewDate,reviewBody,helpfulCount
non accusantium voluptatem,false,1,San Marino,808131,297714,2020-10-20,Perferendis assumenda et pariatur nihil asperiores aspernatur qui sequi. Tempore ex quasi adipisci impedit vel quaerat. Voluptatem voluptas dolorum voluptas quod. Voluptatem quia earum maiores vitae cumque. Voluptate voluptatem a illum nisi est est eos quidem eaque. Perspiciatis eos ut dolores voluptas ad sunt et.,1371
ab totam et,false,0,Mexico,222507,189639,2021-02-23,Et qui fugit doloribus error. Consequatur iusto eligendi molestias illum ut magni consequuntur itaque. Nihil asperiores possimus aperiam aut ipsum nihil nobis aliquid. Et voluptates nostrum.,1216
quia cum quae,true,1,Syrian Arab Republic,572979,27421,2020-07-30,Adipisci quas soluta velit libero saepe rerum ducimus ut. Exercitationem quo quia dolor magnam beatae porro sed saepe nostrum. Voluptatem omnis impedit voluptas saepe quisquam quasi et animi. Est facilis error sunt dolore est ea.,1384
ex aut ratione,true,2,Antigua and Barbuda,3156,242139,2021-06-07,Vero omnis nihil maiores illo dolores doloribus consequatur modi. Non molestiae eius ea enim facere dolor tempore cumque. Maxime repellendus libero illo sapiente velit et sed quos. Illo occaecati unde officia. Exercitationem praesentium voluptatem vel inventore amet aut veniam dolor.,1232
placeat sunt voluptatem,true,0,Saint Lucia,112286,102203,2021-05-16,Perferendis et et sunt voluptate rem facere eos itaque. Ut consequuntur consequuntur error enim qui. In est vero dignissimos ratione.,1354
vitae dolorem iusto,false,3,Reunion,188571,207359,2020-08-11,Ullam autem qui qui veniam tenetur. Voluptatum corrupti officiis et non sit. Qui quo placeat et repellat maiores incidunt. Aperiam aut libero voluptatem beatae repudiandae tempora quisquam quidem. Dicta ut expedita harum laboriosam velit est ullam et. Ipsa veritatis autem cumque quia aut.,1092
ab voluptatum iusto,true,1,Puerto Rico,935714,113450,2020-11-18,Eveniet dolore maxime. Veritatis necessitatibus labore quis molestiae voluptatum. Tempore et non ut error.,40
nulla repudiandae enim,true,3,Trinidad and Tobago,623027,993087,2020-12-28,Minima aliquam tempore delectus rerum delectus maxime et a laboriosam. Qui neque et modi. Quia et sed facilis animi. Voluptatum voluptate ducimus necessitatibus. Culpa accusantium praesentium et rerum. Vitae mollitia maiores a fugit tenetur sed similique velit assumenda.,1366
nobis quae alias,false,1,Turkmenistan,443637,939008,2021-02-12,Quo qui iste. Est eveniet ut aut. Sint qui pariatur. Est harum modi esse illo voluptatem dolores aliquam.,1853
dolore consequatur in,true,1,Kuwait,453598,505088,2020-08-05,Voluptas velit et alias veniam reprehenderit recusandae totam accusantium officia. Doloremque maxime nesciunt ducimus. Explicabo unde aut blanditiis porro temporibus et. Quibusdam sunt et inventore molestiae maiores et consequatur.,1239
dolores voluptas eligendi,false,5,Gabon,392713,653711,2021-03-19,Labore magnam quidem eos dolores velit tenetur. Quisquam eos ut magnam non maxime ducimus minus sit. Cupiditate perspiciatis et. Ex quas qui cumque ipsam. Tempora atque illum et cupiditate. Blanditiis officia hic qui quia a.,931
assumenda similique quasi,true,4,Rwanda,560408,884562,2021-02-04,Consequatur iste maxime aperiam sint tempora et. Consequatur dolore libero. Deserunt quaerat corrupti. Beatae voluptatem tenetur eaque unde odio. Eius ut quo odio. Quae ea deleniti nihil repellendus.,994
dolor accusamus fuga,true,4,Guinea,643972,578816,2021-01-01,Similique unde provident dolores ea laborum itaque. Placeat reprehenderit sint reiciendis nihil autem. Nemo atque necessitatibus iure. Culpa sit recusandae. Neque dolorem debitis voluptas aut et voluptatem veniam saepe incidunt.,885
aut ut magni,true,4,El Salvador,334539,887960,2020-08-04,Corrupti soluta quia. Quidem animi molestiae beatae consequatur aspernatur sit dicta fugit est. Vero voluptatem eos similique aut sed soluta animi nulla voluptatem. Ut inventore rerum consectetur dolorem sint. Eaque architecto minus officiis excepturi quis cumque. Autem ad ducimus rerum ullam sint qui quas voluptatibus.,888
voluptatibus alias rem,false,3,Moldova,835341,696959,2020-12-03,Iusto voluptatem similique voluptatem quidem ea. Est omnis quas quia cum autem odit. Eum deleniti qui labore. Vel nam necessitatibus nihil molestiae qui adipisci sit eligendi.,133
molestiae dolore dolor,true,4,Georgia,384239,159870,2021-04-08,Aut qui ratione assumenda totam laudantium. Dolorem perspiciatis laudantium autem voluptates consequatur amet nesciunt voluptates. Aliquid ducimus molestiae suscipit. Possimus sunt non facere sed et aperiam qui. Adipisci autem ut corrupti suscipit ducimus rerum.,138
eligendi quia dolor,false,4,Romania,674701,723505,2021-02-05,Odit corrupti nihil reprehenderit. Saepe omnis et. Earum consectetur ad suscipit ipsam.,1207
corrupti sit nostrum,true,0,Montenegro,953650,715429,2021-04-06,Modi iusto quasi rerum illum. In libero fuga est. Autem quia doloremque odit voluptate omnis et est. Aut sit quo ipsum minima.,1834
numquam eveniet amet,true,2,Hungary,249064,350678,2021-06-29,Et voluptate placeat autem non reiciendis facilis cupiditate quo illum. Explicabo omnis distinctio accusantium eligendi quae quas enim. Qui vel reiciendis.,1450
sed laboriosam harum,false,4,Serbia,123883,745023,2021-03-31,Quidem ex natus ducimus necessitatibus sunt amet. Sit quia deserunt aut dolorem culpa. Voluptatem rerum doloremque sed aut similique saepe. Labore dolores quae tempora tenetur doloremque alias fugiat.,1058
quo dolore ipsum,true,5,Andorra,141042,122963,2021-01-02,Voluptatibus voluptate ea. Sunt delectus et qui voluptates voluptas maxime magni eum excepturi. Aut officiis nam repudiandae aut ipsum voluptate exercitationem nam. Et odit atque nesciunt eos id laborum sint soluta. Cum dolore quo ab beatae dolorem. Et pariatur et laborum reiciendis.,1297
et dolore accusamus,false,3,Mauritania,181289,716679,2021-03-21,Voluptas incidunt et ipsum praesentium laboriosam dolore. Laudantium omnis doloremque animi. Quae rem sit eos. Pariatur numquam expedita dolorem occaecati.,1840
vero id eos,true,4,Nauru,987855,410218,2020-09-24,Odit dolorem est consequuntur autem amet cum consectetur et. Dolorem aspernatur rerum quia delectus. Aut nihil unde voluptatem. Assumenda est aliquid.,962
dolorum magnam quia,true,3,Guatemala,160307,449875,2020-10-22,Explicabo fugiat delectus quidem. Natus fugiat nobis provident est nemo qui similique eaque qui. Illum veniam ullam provident. Soluta et aut sapiente distinctio eum maiores sed aliquam magni.,1113
dolores et tempore,true,3,Maldives,417535,31845,2021-03-20,Qui minus eligendi nobis quia. Consectetur velit ea recusandae laboriosam. Aut dolore ducimus earum consequuntur deleniti animi reprehenderit quasi.,1909
possimus dolorem aspernatur,false,1,Switzerland,856043,722464,2021-06-18,Adipisci inventore veritatis deserunt consequatur reprehenderit excepturi. Sit veritatis qui qui et et sit explicabo rerum. Reprehenderit sit et voluptatem est id praesentium culpa debitis iure. Dolores non praesentium.,759
minima ipsa eveniet,true,0,Taiwan,758882,516029,2021-05-03,Est quod numquam consectetur est voluptas totam in. Earum voluptatem maiores possimus possimus. Et laudantium est laudantium ea. Porro id exercitationem nemo adipisci. Voluptatem voluptas necessitatibus est molestiae.,1255
nulla et ipsa,true,4,Mauritius,730654,708802,2020-12-22,Excepturi distinctio tenetur temporibus odit. Aut reiciendis error perspiciatis voluptatibus repellendus numquam natus. Ullam est possimus accusamus. Consectetur doloremque et repellat voluptatem tempore nihil.,575
est laboriosam id,false,1,Papua New Guinea,347269,312513,2020-07-07,Repellendus omnis nostrum quidem impedit earum cum ipsam dolor blanditiis. Eos iusto voluptatem reprehenderit harum omnis nobis et. Ad quidem consectetur sed quasi.,796
eos sed illo,true,3,Thailand,153138,589866,2021-05-11,Earum magni et aut. Harum recusandae eligendi tenetur quibusdam neque nihil quas molestias doloribus. Corporis eius reprehenderit velit quo eos.,367
architecto ipsum enim,true,5,Italy,138161,524195,2020-07-11,Quam vel est animi enim repellendus vero. Ut velit in iusto voluptatem. Aut alias qui qui ut sunt totam magnam eos. Ipsa quas optio aut quam doloribus fugit. Eos sed exercitationem. Fugiat accusamus quia.,804
qui impedit consectetur,false,2,Lao People's Democratic Republic,816199,115674,2021-06-07,Distinctio qui nihil voluptas repudiandae numquam earum. Ut aliquam sed id culpa maxime eligendi occaecati ipsam. Suscipit nobis ea ipsum provident cumque a vel. Et consequatur aspernatur. Eveniet similique dicta asperiores sit nostrum. Et magni dolore omnis architecto exercitationem molestias.,1858
rem ducimus accusantium,true,4,Greece,670585,53178,2020-09-30,Deleniti esse in deleniti non et dolor qui veritatis. Est quas veritatis quas nihil dolor qui beatae voluptatem. Quae doloribus eum commodi aliquam fuga. Maiores ut reprehenderit voluptatem.,1288
nemo quas et,true,1,Moldova,43909,135207,2020-08-07,Soluta tempora saepe quia quia laboriosam minima. Accusantium laboriosam quia dignissimos. Natus corporis rerum voluptatibus praesentium ipsam natus sit laudantium. Minima aut est neque tempore mollitia nihil.,1766
et voluptatem fuga,true,1,China,59622,357691,2020-10-05,Doloribus qui atque non quidem earum voluptas. Earum mollitia sequi eius expedita commodi. Sit beatae totam nesciunt qui non temporibus.,1293
sed provident velit,true,0,French Guiana,86966,919761,2021-05-03,Corporis harum voluptatibus voluptas et pariatur omnis aut assumenda. Optio numquam perferendis sint quas incidunt doloribus totam ut quisquam. Vel inventore recusandae saepe est delectus ipsa ea quasi. Quam placeat ut perspiciatis ipsum deserunt aliquid debitis.,744
quia molestias ab,false,1,Panama,400021,654692,2020-10-18,Omnis rerum necessitatibus debitis inventore omnis sit doloribus error. Totam placeat voluptas pariatur. Consequatur qui neque consequuntur earum molestiae quas tempore sed. Aperiam distinctio eos et soluta voluptas aut molestias. Officiis sunt eum velit soluta deleniti perferendis dolores nam fuga. Rem in at maxime consequatur.,594
magni quia eaque,true,2,Greece,528598,921809,2021-04-25,Incidunt reiciendis dolor quidem fuga cumque qui dolores eos. Delectus accusamus rerum libero. Placeat excepturi aperiam velit aspernatur. Necessitatibus tenetur et placeat. Aperiam officiis a aut.,756
in earum voluptatem,true,2,Cocos (Keeling) Islands,714638,217318,2021-06-27,Voluptatem sit qui est quasi eos. Quibusdam minima nesciunt. Non debitis sed vero aspernatur commodi facilis nostrum tempore.,341
et qui non,true,3,Chile,386162,713025,2020-10-25,Est saepe animi repudiandae odio. Ut laboriosam aut. Magnam sapiente nemo accusamus quas nihil.,1040
exercitationem molestiae asperiores,true,2,Iceland,19038,554492,2021-01-26,Ab iste ullam. In delectus est incidunt accusamus. Quia ea qui in vero itaque consectetur. Ipsum delectus molestiae rerum et repellat enim deleniti iusto possimus.,1435
non aut eligendi,false,3,Guadeloupe,227378,480491,2021-03-26,Accusantium id soluta dolor totam dolorem alias. Rem cum quidem suscipit. Rerum veritatis rerum illum fugit non. Dolor similique iste aut. Ut est qui iure rerum magnam voluptates non et. Dignissimos doloremque maiores quaerat quo sit.,1524
et quaerat cupiditate,false,1,Switzerland,598236,218352,2021-06-16,Aut repellendus est blanditiis in officia molestias eligendi quia. Itaque consequatur mollitia illo vel sapiente aliquam. Sit cumque molestiae hic vero illum ut aliquid.,1508
qui ipsum reiciendis,true,4,Austria,367275,901556,2020-07-15,Eaque est nihil vero. Iure earum sit soluta fugiat alias eaque placeat aut laudantium. Et vero recusandae. Est ut repellat numquam velit harum omnis. Odit aspernatur dolore hic beatae eius dolorem ut consequatur.,1942
nam qui quo,true,5,Saint Vincent and the Grenadines,863805,411004,2021-02-05,Voluptas dolor quisquam error. Soluta laborum molestiae. Provident deleniti sed ex fugit fugit amet et est nesciunt. Sed sunt nam omnis asperiores. Hic et aut ut delectus sit nobis et.,410
quia est totam,true,2,Argentina,313825,323150,2020-11-23,Similique eligendi deserunt in reiciendis sapiente aperiam vero cupiditate. Autem et voluptas laborum modi sint sit ducimus sunt. Sit unde nisi excepturi iste nam.,1500
autem modi architecto,false,4,Syrian Arab Republic,269767,57487,2020-08-07,Magni et vel debitis nisi ab qui nihil eos sint. Ad harum et est ipsa unde quasi dicta a. Eaque omnis commodi atque voluptatem sequi. Fugiat error officia. Et aut omnis nam eos.,1595
vel omnis reprehenderit,false,5,Hong Kong,245117,997157,2021-06-16,Optio quibusdam quam consequatur. Ut aut deserunt nostrum excepturi perferendis doloribus a. Consequatur et autem. Hic dolor rerum commodi.,1172
culpa aut magnam,true,3,Kazakhstan,795225,223625,2021-05-09,Quia non eligendi rerum. Iusto nihil occaecati odio occaecati et laudantium dicta deleniti. Eos aut saepe. Pariatur impedit sed iure excepturi eum. Fugit praesentium cupiditate ex.,687
dolor sit perferendis,true,1,Nepal,159945,884517,2020-07-20,Voluptas ut sint quidem ut eveniet facilis omnis fugiat et. Asperiores nihil rem rerum ad quia. Enim corporis quam voluptates fuga odit incidunt et error quo. Ut deserunt a ipsa eius similique qui ut.,199
dolor consequatur ut,true,4,Marshall Islands,580033,865583,2021-04-08,Quae numquam assumenda odio est. Explicabo ab dolor sequi explicabo voluptas. Odit asperiores esse. Nostrum ex deserunt. Consequuntur occaecati a incidunt sit ut.,219
et repellat earum,true,3,Bosnia and Herzegovina,128297,656319,2020-09-20,Tenetur autem doloremque voluptatibus ut officia ut pariatur. Vitae sunt ipsa rerum harum labore blanditiis consequatur sit ut. Quia iusto ut consequuntur exercitationem voluptas doloremque.,1973
ad iusto iste,true,0,Rwanda,452534,275061,2020-10-05,Quis totam corporis ab laborum quia voluptatem. Odit consequuntur laboriosam et rerum nisi. In laborum occaecati cumque quaerat occaecati.,679
cum ea corporis,false,4,Croatia,886975,598464,2021-02-25,Harum at rerum ut accusantium. Sit non ratione quisquam quidem et ut autem. Doloribus deserunt voluptas eligendi sed et ut magni at error. Minima vero odio eaque nisi recusandae. Iusto dolores eveniet molestiae et soluta. Aut incidunt cumque est.,1243
laudantium qui quod,true,0,Algeria,371650,937508,2021-03-10,Similique omnis iste ut impedit. Est nihil odit. Magni ea cupiditate omnis eum qui corrupti qui. Et atque commodi nihil repellendus dicta excepturi nobis voluptatem nostrum. Eaque ex libero labore voluptas nemo et dolores aut et. Ut repellat quis unde minima aut vero quis dolor qui.,1354
odio consequatur voluptas,false,3,Virgin Islands British,972310,213687,2020-10-07,Rerum ducimus deserunt aperiam suscipit dolores accusamus ullam et. Vel ut totam ea sed ipsam. Dolorum aut eligendi inventore iure a quas pariatur. Eius expedita eligendi repellendus sed rerum vel.,1229
aliquid consequatur incidunt,false,2,Rwanda,599483,569696,2021-04-30,Aut suscipit velit eveniet porro ut quas non vero. Repellat voluptatibus quo id totam est iste quibusdam. Occaecati dolore sit.,115
dolorem omnis ut,false,1,Heard Island and McDonald Islands,894780,385223,2021-06-24,Ea voluptatem adipisci esse. Natus et suscipit voluptas ducimus enim. Aut sapiente quos dignissimos.,373
accusantium quod impedit,false,4,Australia,215976,599984,2021-01-18,Nemo atque sit aspernatur. Et ab doloremque. Aliquam earum excepturi quisquam. Quasi et ut et et saepe voluptas. Exercitationem autem quis. Voluptatem quia totam ratione.,1323
deleniti iste similique,false,4,Australia,438720,503135,2020-10-08,Et in repudiandae quis consequatur rerum recusandae sit laudantium. Sed in soluta. Et aliquid dolores quaerat voluptatem iste.,420
consequatur ab possimus,false,4,Argentina,93227,646790,2021-01-03,Ea ex nesciunt non vel accusamus excepturi. Aliquam aliquam illum cupiditate consequatur provident neque. Dolor esse nostrum possimus consequuntur et tenetur. Est consectetur quidem voluptas repellendus iste voluptatem.,1040
harum rem eius,true,0,Romania,774165,435095,2020-08-02,Molestiae est hic praesentium ut sit quo odio sunt. Dolores maiores sunt eligendi eum laudantium quibusdam odio quam aut. Id sint exercitationem dolor. Rerum omnis asperiores dolorem exercitationem dignissimos sit consequatur.,1183
ipsum at in,true,3,Pitcairn Islands,356697,200519,2020-11-07,Nemo voluptas amet maxime ipsum. Magnam ea accusantium consequuntur tempore aut. Maxime qui qui. Nihil perferendis itaque id totam tenetur magni.,7
est eos totam,false,0,Chile,635791,910941,2021-05-05,Aperiam voluptatem praesentium numquam ipsa rerum mollitia ipsa. Quis consequatur possimus nemo quas sunt totam. Accusamus quod molestias cupiditate quia magni in dignissimos.,318
est sequi quos,true,3,Egypt,614557,926338,2021-05-05,Velit aperiam et minus vel labore ex. Voluptas explicabo rerum sint aliquam laudantium illum. Nulla temporibus quos architecto nihil dolor. Dicta sunt ea harum aliquid veniam.,1068
qui optio voluptatem,false,0,Luxembourg,273253,744424,2021-02-27,Consequatur neque voluptatem distinctio vel perspiciatis. Sit voluptate quaerat. Sed recusandae blanditiis aliquam.,686
quam fugiat et,false,2,New Zealand,160595,841829,2021-04-25,Dolorum tempora qui est. Harum nesciunt non est ea delectus nihil non quisquam. Maiores dolorem eos at aliquam unde est nisi odio. Et rerum velit accusamus pariatur tempore cumque qui. Assumenda perferendis repudiandae facilis assumenda quam dolor. Laboriosam voluptatem enim nihil velit rerum reiciendis dolore fugit.,1640
fuga quasi distinctio,true,2,Palau,796356,360072,2021-05-06,Perspiciatis esse et. Libero veritatis ab est sit ut assumenda a et cum. Et dolore aspernatur iusto quia.,1275
aut laborum eius,true,2,Mayotte,564958,270719,2021-03-25,Ducimus corrupti aut. Libero rerum rerum in voluptatem quam et. Eius fugit labore rem occaecati adipisci. Ut autem facere modi quae ut saepe. Architecto qui dolores quo non et.,1081
illum at id,true,3,Mozambique,151691,320273,2020-10-12,Qui assumenda qui blanditiis et nisi beatae cumque quas. Eaque consequatur omnis fugit voluptatibus sunt. Eligendi vel quas ab ea velit eveniet quo repellendus. Molestiae modi quas sed ipsum qui. Magni natus hic odio. Aliquid optio incidunt.,590
modi maxime autem,true,5,Antarctica (the territory South of 60 deg S),789142,694022,2020-08-10,Dolorem culpa aliquam quia mollitia tempora vitae eum minima deleniti. Itaque voluptatum voluptas laboriosam qui praesentium aperiam minus. Sed modi ut voluptatem. Aut ut et dolorem vel est est.,1458
non dolor sint,true,1,Antigua and Barbuda,493219,549322,2020-11-05,Mollitia possimus et officia dignissimos explicabo. Laudantium enim totam vero temporibus voluptas est dolor et. Consectetur et facilis qui incidunt nostrum odit nihil assumenda commodi. Et nisi aut dolores ipsum iure.,407
incidunt soluta tempora,false,2,Norway,958542,200265,2020-09-19,Consequatur nam perspiciatis. Unde animi dolore et rerum. Maxime aut non ea sit non. Non sunt saepe deleniti et illum minus. Repellendus voluptas vel consequatur non ratione rem vel minima. Voluptas omnis inventore deleniti voluptatem illum temporibus.,1686
quisquam quisquam cumque,true,1,Dominican Republic,498753,943434,2021-02-26,Quis voluptates incidunt rerum dicta. Molestiae dicta et. Eum facere eveniet voluptate tempora corrupti minima. Qui voluptas ut quia sed quo est commodi quaerat culpa. Sed non ut hic aut amet sed quisquam.,1820
dolore sit aliquam,true,0,Denmark,464456,655219,2021-01-25,Ipsa et et. Sed quod hic itaque optio perspiciatis voluptatem dolorum fuga. Quaerat qui blanditiis omnis sed fugiat dolorem culpa modi corporis. Dolorem qui iste similique laudantium quia. Accusamus itaque maiores quia in vitae cum et.,1177
qui aut qui,true,4,Sri Lanka,642892,331753,2020-08-10,Nihil rerum nesciunt perspiciatis sint distinctio. Et laboriosam et id voluptatem possimus molestiae. Dignissimos reprehenderit voluptatem sint non reiciendis. Explicabo quis temporibus consectetur dolorem accusantium quae itaque modi praesentium. Adipisci nisi magni similique illum eos.,202
sapiente cum esse,false,1,Cayman Islands,413298,29339,2021-05-18,Et aspernatur provident dolore. Tempora ullam dolores autem id. Est et ut et. Qui ducimus velit et quas sapiente ipsa. Qui in voluptas dolor.,1215
reprehenderit laudantium rerum,true,4,Liberia,156921,86041,2021-04-11,Et et voluptatem odit aut saepe alias. Incidunt molestiae nulla rerum. Neque ipsa sit repellat earum quis. Voluptatem minima quam aut quia dolorem maxime. Enim magnam doloremque odit recusandae delectus laboriosam error commodi.,1290
est officiis consequuntur,true,5,Argentina,267362,652420,2021-03-20,Nam molestias minima veritatis deserunt aspernatur aut officia animi. Porro rerum voluptate dolorem explicabo quibusdam id rem non. Explicabo quo sunt et molestias quia. Eum voluptates aliquid voluptas quia qui doloribus. Aliquid quos rerum est porro numquam. A sit quam iure beatae vero amet enim facere aut.,282
quo consectetur fuga,true,4,Falkland Islands (Malvinas),200654,913125,2020-12-21,Fuga ea cum molestias qui sed unde. Consequuntur eveniet amet facere non. Qui totam molestias voluptate error necessitatibus autem dignissimos et.,344
quaerat sit quibusdam,true,0,Papua New Guinea,189069,439909,2021-06-26,Reprehenderit non et velit esse enim natus incidunt debitis ab. Quia eligendi vitae perferendis et optio at qui. Consequatur necessitatibus et ea officia est non aut cupiditate occaecati. Soluta recusandae et voluptatibus incidunt laborum.,645
velit hic eaque,false,2,Heard Island and McDonald Islands,927779,573028,2020-12-07,Id nesciunt minus fuga inventore odit temporibus. Quam ut et iste consequatur autem. Earum nisi sit. Impedit cum maiores dolor adipisci odio qui cumque.,1403
deleniti blanditiis exercitationem,true,1,Belarus,996090,358293,2021-01-23,Earum recusandae quis voluptates voluptatum dolores cumque voluptatibus nobis commodi. Aspernatur est quibusdam deserunt maiores ipsa id sed labore eligendi. Quisquam at ex officia dolore illum explicabo tenetur dolorum. Omnis qui in vel error earum voluptatem voluptatibus doloremque blanditiis. Sit ex atque adipisci animi voluptas eum odio. Qui ipsam dolorem nostrum sunt.,1449
officia similique culpa,false,0,Namibia,977827,952901,2021-04-12,Quia et doloremque incidunt temporibus. Sunt sunt quidem. Tempore ea impedit. Perferendis nobis quaerat distinctio porro aut distinctio ex reprehenderit rem. Aut qui temporibus. Perspiciatis doloremque et est ex.,1874
fuga quo adipisci,false,4,Cote d'Ivoire,318840,54675,2021-01-21,Ut ea voluptatem alias cupiditate voluptatem maiores omnis. Ex quis qui nihil quis. Laborum et et occaecati voluptas. Doloribus maiores nostrum est aut laborum optio aperiam saepe voluptatum. Quaerat maxime quis tempora doloremque soluta officiis.,313
ea qui repudiandae,true,3,Ghana,700799,466408,2020-09-05,Aut non nam totam quia atque aut autem. Illum iste eos voluptatem veniam velit. Ipsam aut et occaecati culpa quo velit. Incidunt voluptate sapiente earum voluptate non. Quia id commodi ratione qui sunt aut.,1357
ipsum voluptas quisquam,true,4,Austria,992980,672416,2021-02-24,Quo ad accusantium facere consectetur placeat quia voluptatem. Itaque rem numquam nihil earum sed. Voluptatem quas quibusdam temporibus voluptatem. Error sapiente repellendus quo neque necessitatibus minus. Ex sunt aut facere eum quod nesciunt eligendi.,1027
similique deleniti consequuntur,false,1,Benin,802335,181438,2020-11-09,Reiciendis soluta velit dolorem alias magni et inventore et labore. Dignissimos aut similique vitae optio consequatur est in vel. Aliquid quis et non et exercitationem et nihil.,1530
corporis aut quod,false,0,Tanzania,518491,468048,2020-11-23,Autem explicabo dolorum culpa commodi aliquid. Non quo voluptates voluptate a nobis aut sed molestias. Id quaerat in explicabo nostrum quod architecto. Rerum ad maiores fugiat voluptas eaque esse praesentium.,1881
qui qui quidem,false,3,Guernsey,316160,191392,2020-08-29,Rem molestias non aspernatur aut qui beatae quia nemo itaque. Dolores est inventore expedita. Officiis ut dolorem reprehenderit dicta eos impedit quis animi eos.,1718
aut ut illo,false,1,Dominican Republic,47295,190575,2021-01-23,Rem sed debitis a fuga aliquam necessitatibus et commodi. Consequatur distinctio eum consequuntur provident nihil eligendi facere consequatur sit. Magnam ad illum molestias aperiam nam aliquid consequatur nostrum. Et iure soluta ipsum recusandae labore nobis error.,1665
aut et nostrum,false,4,Bulgaria,106890,133001,2020-08-08,Quia qui qui. Nihil sint similique molestiae qui. Quas voluptas nihil. Facere quae et rerum ex aut et id dolorem architecto. Quo reprehenderit voluptatem veritatis quod cum. Id exercitationem eos consequatur ut omnis velit cupiditate.,951
ipsam sint qui,true,5,Burundi,92274,985635,2020-08-22,Explicabo ratione fugiat aut ut. Vero dolorem harum. Minus nam ut tempore et nobis dolor. Vero praesentium ad reprehenderit.,635
ex qui quasi,true,0,Lithuania,357487,459632,2020-10-02,Quas corporis rerum sint quibusdam. In dicta commodi. Blanditiis et harum explicabo rem adipisci consectetur expedita. Enim nobis nihil. Velit voluptatem voluptate rerum delectus sit quo earum. Ab fugit similique aut ullam inventore dolorum tempora vero.,167
et in vel,true,0,Eritrea,598693,638173,2020-12-13,Et odio voluptatem delectus et. Suscipit excepturi at enim placeat iure quia consequuntur quia. Eveniet mollitia blanditiis. Eos sunt in ea est qui itaque natus recusandae omnis. Dolor sit id.,152
