title,abuseReported,rating,location_,userid,productid,reviewDate,reviewBody,helpfulCount
eius fuga voluptatem,true,3,Guinea-Bissau,204302,958282,2020-09-09,Illo totam delectus veritatis repudiandae rerum reprehenderit quod. Accusamus beatae ullam. Est architecto saepe officia animi totam non atque. Laudantium quaerat aut quia explicabo dolorum sequi at maiores. Quidem voluptate suscipit quo similique repudiandae.,199
voluptatem voluptatum nesciunt,true,2,American Samoa,32364,578628,2021-03-16,Iure fugiat exercitationem dolorum quo in numquam et est est. Dicta aut voluptatem maxime repudiandae molestiae ad expedita. Qui qui voluptatem.,1647
debitis libero aliquam,false,3,El Salvador,246578,237402,2021-05-03,Laboriosam eius porro quia ipsum. Culpa deleniti consequatur repellat aperiam aut et aut quo. Quam quidem omnis dicta. Aut quasi tenetur voluptatum et vero iure. Amet dolore molestiae sint aut qui nobis ut vel.,1544
beatae temporibus qui,true,3,Cuba,569588,478190,2021-02-02,Aut iste voluptate. Rerum dolorum molestias et sit fugiat et. Ullam debitis dolorem esse eaque sapiente enim. Veniam autem ipsum reiciendis.,1777
est voluptas qui,false,1,Costa Rica,2837,420039,2021-06-21,Aliquam quibusdam rerum veniam fugiat veniam ratione. Qui delectus et. Quisquam provident distinctio ut rem.,494
a ab ipsum,true,1,Isle of Man,911680,677320,2021-04-08,Quia omnis adipisci facilis suscipit voluptas perferendis voluptas error. Officia reprehenderit ipsa est reprehenderit est vero incidunt nesciunt. Nisi beatae et minima atque aspernatur.,1402
ad quas voluptatem,false,2,Tonga,460465,551922,2020-08-08,Pariatur dolor et voluptate. Perspiciatis eius voluptas sit tempora eveniet sint perferendis quam debitis. Et accusamus molestiae aut repellat. Quibusdam iste voluptatem ducimus esse assumenda non quisquam. Facere est qui qui mollitia harum porro quas illum quia. Vitae eos quibusdam.,619
non vel maxime,true,4,Costa Rica,10033,598217,2021-01-08,Sequi dicta quibusdam error culpa. Ipsa est sunt. Numquam natus velit saepe qui. Consequuntur et et magnam expedita eum. Necessitatibus sed corrupti ut fugit necessitatibus tempora corrupti aspernatur.,69
iste alias labore,true,2,Sri Lanka,257293,775939,2020-10-07,Sed mollitia sed. Quisquam sit et voluptatem nulla suscipit quia. Praesentium ipsam aut sunt. Alias sed mollitia adipisci ullam et reprehenderit.,1282
quam non beatae,false,3,Bermuda,257587,819746,2021-01-11,Non saepe distinctio eum repudiandae. Possimus recusandae perferendis reprehenderit doloribus qui quidem sit quaerat. Ut explicabo molestias. Quos earum animi non commodi voluptatem. Repellat est labore facere repellendus molestiae quae quia voluptas.,1919
voluptatem aut sunt,true,4,Virgin Islands British,295978,66380,2021-06-01,Ipsa nam sit et dicta iusto. Labore eos expedita doloremque voluptatem animi rem maiores dolores. Optio qui quia quae ea cupiditate et et aliquam. Sed debitis explicabo dolorem ut dolores aut eius et. Labore explicabo voluptate quos impedit blanditiis id nobis modi incidunt. Alias placeat dolorum fugit nulla et.,940
quia et molestiae,false,0,Kiribati,484677,311658,2020-12-10,Molestiae et assumenda molestias alias vel non veritatis earum autem. Sint provident ipsa optio in sapiente id velit. Corrupti perferendis laboriosam est dicta et quis voluptates incidunt. Veniam possimus et perferendis sed dolor.,229
suscipit facere ut,true,4,Poland,905307,330921,2021-03-17,Optio soluta quia ea. Fugiat aut voluptate soluta. Repellat molestias velit iusto voluptas alias.,380
voluptatem eum dolor,false,2,Benin,568674,292844,2020-10-17,Nisi soluta eligendi aliquam. Qui quis rerum modi assumenda aut enim aspernatur ut in. Quia modi rerum et quisquam et odio expedita qui magnam.,1787
voluptatibus autem officia,true,0,Bangladesh,410910,321173,2020-07-22,Illum nobis numquam reiciendis. Sit occaecati expedita consequatur. Ut sint nam ut eaque. Est commodi porro consequatur nihil autem itaque et.,1566
inventore ea distinctio,true,0,Ghana,545893,265578,2020-08-11,Est harum commodi et quo est iusto ipsum molestiae. Minus maxime quod sed esse. Delectus porro corrupti commodi aut doloremque amet dolore. Accusamus sed soluta laborum nisi ut. Sunt iusto sapiente qui aspernatur et aut est soluta laborum. Sapiente qui odit ut praesentium.,1238
et sint dolores,false,3,China,269530,607462,2021-07-04,Qui libero temporibus fugiat et expedita ut consequatur. Voluptate numquam beatae quod et a quos ducimus eum. Et qui recusandae aliquam corporis veritatis error in tempora ut.,1013
soluta eos quia,true,2,Cyprus,933160,462226,2020-09-07,Harum dolor aut autem aut consequuntur vel. Maiores aperiam velit cumque corporis. Repellendus ut cum ex nobis quo est sunt. Officia porro incidunt quia. Fugit asperiores unde consectetur nostrum. Vel dolore quia.,1345
doloremque eum fugit,false,3,Argentina,425900,67816,2021-01-20,Ab quaerat quis a officia. Recusandae tempore enim. Aut magnam quis. Nostrum natus consequatur similique dolores suscipit odio.,96
tenetur non sit,true,0,Guam,673901,596790,2021-03-24,Tempore quaerat ut aut modi debitis aliquid velit. Et repellendus veritatis est commodi incidunt qui quod expedita minus. Dolorum fugiat doloribus. Dolorem velit fuga cum aut. Porro quo aut ducimus.,894
ducimus eveniet ut,false,2,Poland,186248,47842,2020-07-10,Incidunt consequatur architecto. Ab dolorem assumenda reprehenderit dolorem tempore. Iusto iusto ut nihil atque harum doloremque. Nostrum sint quis et molestias qui fugiat atque molestias. Voluptatem quia id culpa atque et quia hic temporibus.,500
sed aspernatur est,false,0,Panama,389977,256363,2021-06-14,Id laudantium iste delectus corrupti deleniti asperiores quisquam corporis. Quaerat vel dolorum tenetur. Explicabo perspiciatis et ea qui dignissimos et dignissimos. Eveniet laboriosam ipsum esse optio molestiae. Repellat a modi aliquam delectus eos et. Non vero saepe.,1907
incidunt est qui,false,3,British Indian Ocean Territory (Chagos Archipelago),509292,263391,2021-03-10,Voluptatum quia nostrum qui sit omnis est sit consequatur. Vel impedit totam dolorem molestias harum iure consequatur beatae. Quis quibusdam accusamus velit aut reprehenderit natus non.,418
omnis maiores iusto,false,3,United Arab Emirates,420512,158669,2020-11-02,Nulla id culpa consectetur et. Aliquam exercitationem accusamus nemo quia. Ut aut libero dolor laborum asperiores esse. Et omnis sed corrupti iure veniam quaerat est neque unde. Similique aut sint et enim aut.,453
ut voluptatem animi,true,3,Togo,10521,681158,2020-12-06,Qui reprehenderit dolor cupiditate ab quod. Qui incidunt nobis. Voluptas cum reprehenderit id quidem repudiandae. Qui non assumenda earum optio et error sit. Autem quisquam in consequatur.,1754
explicabo quidem et,true,2,Vanuatu,515023,233304,2020-08-21,Quibusdam similique voluptas voluptas voluptate et error. Et dolorem quia. Quia non at. Et voluptatem minima dolorem qui voluptatem culpa. Beatae voluptatem ullam delectus sunt nulla veritatis rerum. Ut illum asperiores ipsum doloribus exercitationem officia.,258
ut ea sit,false,4,Kenya,852490,458751,2021-02-28,Delectus alias ipsam voluptas iste repellendus rerum error tempore animi. Officia dicta voluptas quod nihil voluptas quia vitae. Et incidunt doloribus praesentium quia totam dolor ut ipsam error. Vel impedit dicta ex.,1369
temporibus dolorem dolore,false,4,Ghana,669147,845613,2021-02-10,Nemo et est deserunt perspiciatis occaecati fugit praesentium. Laborum aut magnam voluptas vero natus. Quidem labore quo sint accusamus et et.,1143
amet rerum earum,false,4,Myanmar,904047,810391,2021-02-23,Voluptatem nihil quo in id non doloribus. Velit quia laborum eos. Molestiae impedit eaque. Tempore quasi et nam quia voluptas iure voluptas eveniet delectus. Temporibus repellat quo consequatur omnis minima culpa dolorem repudiandae. Molestiae autem cumque et ut nulla perferendis dolor quia animi.,706
aut quam alias,false,3,French Guiana,875551,262410,2021-03-10,Qui ab maxime et veniam aliquid sed sed et et. Rerum quo sequi ut quam. Numquam recusandae et nobis eveniet aut. Nam possimus et autem aut atque inventore. Nobis autem laudantium laboriosam aut impedit placeat illo facilis. Rem est et ut cupiditate.,1285
eos at rerum,true,1,Azerbaijan,836858,924650,2021-01-07,Temporibus quae et quis magni. Ut quaerat doloribus magni et explicabo quisquam eaque. Atque sapiente accusamus. Aliquam nesciunt perferendis quos modi non debitis quo quibusdam. Excepturi amet deleniti nisi quaerat non.,1356
laudantium ea nesciunt,false,2,Haiti,230431,94181,2020-10-15,Voluptas et iusto est quis qui. Recusandae ab nisi id nihil esse iusto ullam. Nihil consequatur assumenda. Et molestiae sapiente sunt officia accusamus ipsa non autem consequuntur.,865
ipsa excepturi et,false,4,Republic of Korea,134459,511065,2021-05-30,Doloribus nam quia quas non quaerat delectus autem. Nostrum fugiat culpa enim nam ex. Corrupti a accusantium ut sint. Non sint qui voluptatibus qui at sed possimus ipsum voluptas. Est illo placeat dolores dolore ut. Neque eius dignissimos.,457
voluptatibus voluptatem earum,false,1,Brunei Darussalam,736037,82225,2020-07-21,Animi architecto rerum nobis pariatur id. Est impedit repellat expedita qui nobis iste. Cumque consectetur optio voluptatem nesciunt aperiam qui veritatis sint quidem. Consequatur quod voluptate in. Voluptates occaecati maxime et.,1638
suscipit voluptatem rerum,false,4,Saint Pierre and Miquelon,360924,400597,2020-11-23,Minus ut laudantium velit velit optio accusamus. Accusantium exercitationem ut et quaerat consequatur impedit. Ipsum eos assumenda. Esse et ducimus tenetur rerum quam quo qui. Impedit ut laborum doloremque.,808
laborum delectus quos,false,3,Nauru,650851,390135,2020-11-01,Nostrum sint est a dolorem alias fuga qui et. Vel voluptates et. Maiores omnis quibusdam.,316
quam porro asperiores,true,4,Democratic People's Republic of Korea,918343,51002,2020-08-16,Quia ipsam sit assumenda architecto dolores. Excepturi libero ad quo numquam ex nostrum id aut. Non nihil molestiae ea. Iure asperiores voluptatem fugiat. Omnis ut quis porro dolor est officiis.,164
voluptas quidem dolorum,false,5,Thailand,709777,556360,2020-07-21,Architecto aut sint mollitia. Qui optio eaque assumenda incidunt in et. Ut id velit sint dolore officia quaerat culpa.,885
quam et sint,false,1,Tajikistan,450591,831943,2021-06-14,Et reiciendis omnis repudiandae aliquam esse. Ducimus expedita nulla pariatur voluptates nulla enim dolores est ut. Et non qui illo adipisci consequatur qui. Perferendis esse necessitatibus itaque maxime id. Tempore exercitationem sed et saepe hic atque.,1449
aut ut omnis,true,2,Kyrgyz Republic,635601,336863,2021-03-14,Et dolorem enim inventore excepturi iusto modi. Saepe quas et quas aperiam dicta quisquam veniam architecto dolorem. Dolores maiores rerum nulla sapiente. Deserunt ducimus consequatur voluptatibus facilis quia voluptas labore qui inventore. Nobis saepe ipsum magni quia veritatis amet asperiores porro. Quaerat rerum quia sunt.,638
quas ut sapiente,false,5,Belize,807661,641637,2021-05-15,Similique vero aut repellendus nemo facilis corrupti ut qui. Et inventore omnis ratione qui ipsum sed sit. Ratione facere blanditiis autem. Ea incidunt aut placeat molestias autem voluptatum.,911
quis soluta nihil,false,1,Denmark,569177,756367,2021-03-30,Autem sit facere dolore tempore non officiis. Recusandae fugit molestias rem a autem deserunt. Nemo perspiciatis id odio at ullam fugit.,23
ullam suscipit vero,true,1,Ukraine,636107,678546,2020-10-19,Animi magni molestias esse et ad a voluptate aut. Alias sunt dicta provident deserunt. Velit qui eos nam consequatur velit et vitae quasi. Enim aut est aut impedit similique tempore. Ratione error qui id aut optio architecto amet possimus. Voluptas pariatur a eum ut unde consequatur dolorem.,1588
voluptatem voluptatibus odit,false,2,Bhutan,457716,615408,2020-09-20,Praesentium est soluta voluptas harum qui quod beatae molestias consequatur. Neque dolores omnis quisquam ea quis inventore ea velit. Dolore nihil ea ea debitis quas. Tempore commodi doloribus eligendi quo repellat voluptates.,64
et quibusdam enim,true,5,Saint Kitts and Nevis,452851,467969,2021-01-26,A dolorem illo maiores corporis enim ea harum sit. Quo sint libero ut nemo aut enim consequatur dolorem et. Aut et omnis excepturi quasi eum ea atque quod.,218
quam veniam aut,false,3,Albania,159717,222811,2020-10-27,Sunt cumque deserunt est. Quia placeat sapiente eum nihil quae provident provident. Perspiciatis consectetur eaque eligendi facere ad sapiente velit. Et voluptate est illum minima in laudantium.,317
repellat autem est,false,1,Poland,110675,920320,2021-03-10,Sapiente tempora eaque quae est rerum. Repellendus a fugiat officia omnis. Perspiciatis debitis labore et reprehenderit porro eum impedit. Quo suscipit autem magnam necessitatibus qui debitis consequatur dolore. Error aut laudantium amet ad omnis ut. Consequatur dignissimos quisquam inventore sunt corporis asperiores sapiente velit.,959
nostrum molestias provident,false,0,Armenia,248943,927950,2021-02-24,Aut atque quos qui libero nihil voluptas saepe iste. Quia qui tenetur. Doloremque vel doloremque harum sed necessitatibus maiores fugit rerum.,1825
omnis quibusdam iste,true,1,Croatia,593194,536900,2021-01-01,Et repellendus in cum eaque suscipit. Et ut dolorum. Architecto dignissimos eaque mollitia.,1241
placeat est rerum,false,2,Taiwan,513194,820816,2021-04-15,Aut illum qui tenetur in sit sunt sit. Dolorem enim doloremque sit error et. Ut et eveniet magnam aspernatur hic sit est tenetur sunt. Illum dolores iste quod nihil ut quia aut ducimus dolores. Voluptatum expedita ea autem.,173
est non iste,false,2,Belize,622225,315154,2020-12-03,Facere possimus odio vel temporibus magnam facere. Exercitationem autem quae quia cum. Error et soluta voluptatibus cupiditate a et. Dolores temporibus repellendus dolor vel adipisci eum quia eos. Saepe sunt voluptatem nostrum. Voluptas reprehenderit aut suscipit.,457
ut enim dolorum,true,0,Iceland,251804,418587,2020-11-01,Error in quo. Fuga at est. In sit dignissimos error ex illum quos. Animi quisquam consequatur aspernatur accusamus. Excepturi minima voluptatum ut natus sunt odit aperiam sequi.,1631
illum dolores beatae,false,5,El Salvador,976103,42501,2020-07-07,Fugit dolor enim perspiciatis consequatur cum. Sit omnis id. Ex dolor quia deserunt qui. Minima qui dicta ea minima voluptates voluptas dolor nam ea.,1328
molestiae dolor perspiciatis,false,4,Gambia,217948,889398,2021-03-07,Amet expedita recusandae blanditiis debitis animi sint minus. Sed et asperiores aliquam occaecati. Ut et maiores reprehenderit aliquid est qui eius.,1680
amet sint rerum,true,1,Pakistan,842607,774440,2021-05-14,Rerum ratione quibusdam odit ipsa consequuntur. Quis incidunt quaerat voluptas eos ut qui dolorem. Provident voluptatum corporis odit non temporibus quam. Aliquid enim aut.,1401
in omnis officiis,true,4,Tajikistan,807422,599447,2021-02-14,Et iure rerum distinctio labore sed id. Labore ipsa unde est molestiae totam omnis. Voluptatem neque ad eligendi necessitatibus perferendis quia repellat ipsum. Ut rem harum ex assumenda. Id autem quasi. Commodi voluptates totam magni cumque.,484
ullam unde quae,true,0,Cameroon,398037,348379,2021-07-04,Et qui ab nisi provident numquam. Modi magni qui eos amet sunt ipsam explicabo et nulla. Voluptas rerum maiores dolore et.,1037
doloremque cupiditate odit,false,5,South Georgia and the South Sandwich Islands,717872,566161,2020-09-15,Ut id nesciunt aut dignissimos quisquam quod dolorum. Veritatis ut dolorum eos quia necessitatibus delectus. Officia quo velit odit ad vitae possimus fugiat. Id inventore non velit consequatur sapiente. Rerum repellendus voluptates quidem unde minus consequatur aspernatur.,668
debitis incidunt odio,false,1,Guinea,390035,721753,2020-09-16,Quos tempora non atque nam. Amet suscipit excepturi sint alias omnis explicabo quia fuga. Voluptatem dicta molestiae ut. Neque vero et debitis tempora dolores et.,1135
quos sint quas,false,0,Madagascar,423937,245262,2020-10-03,Tempora molestias neque voluptatem nemo necessitatibus est. Ut numquam vel magnam et. Molestiae rerum velit assumenda et in.,324
quae odio dolores,false,4,Singapore,950145,560369,2020-09-04,Commodi similique voluptatibus minima quas fugit est consequatur et. Rerum eligendi et et sed. Voluptates similique omnis. Qui sit facere. Laboriosam explicabo sunt iusto quos quibusdam. Laborum omnis nam fuga sit optio laborum.,73
provident sit facere,false,2,Trinidad and Tobago,861601,276061,2020-07-09,Iste sequi neque assumenda alias enim aut harum consequatur. Et enim qui. Est sed vero. Autem velit minima ipsam placeat voluptatem repellat. Qui quia sed quia rem. Perspiciatis ut minima sint consequuntur.,377
temporibus molestiae suscipit,true,4,Vietnam,792419,285539,2021-06-25,Aliquam sit omnis error et corporis. Aut consequatur porro porro enim ullam et expedita pariatur esse. Ea pariatur quis aspernatur quisquam consequatur quas.,1442
quia omnis praesentium,false,3,Uruguay,443601,32895,2020-09-12,Vero molestiae sit consequuntur. Voluptatum odio explicabo ab est in fugiat debitis rem. Maxime unde dolorem et eligendi debitis officia ut illo. Similique error quidem nam quod quo et dolores inventore in.,789
quia placeat voluptates,false,0,Turkey,603741,376370,2021-01-11,Harum eveniet consectetur ullam necessitatibus non maiores. Veniam quis nam libero. Est iure consequatur assumenda quibusdam dolorem error est. Consequatur ipsum quo omnis quia sapiente suscipit in natus consequatur.,461
voluptatem consequuntur vero,true,5,Heard Island and McDonald Islands,599435,889874,2020-09-24,Ex commodi corrupti impedit id error iste architecto nostrum. Voluptatum aliquid magnam. Impedit at est autem quas eaque sit quae et. Officia et rerum maiores sed placeat.,928
illo odit eos,false,4,Brunei Darussalam,767838,681874,2020-08-29,Omnis enim optio ut libero sequi. In odit sint aut consequatur eum. Alias et excepturi sed non. Sed in iste nulla quia veritatis. Sed veniam dolor.,459
consequuntur rerum ratione,false,2,Portugal,230791,124110,2021-02-18,Quos quia voluptas modi nesciunt eos id qui beatae molestiae. Fuga tempore dolor qui animi cum ut soluta tenetur consequatur. Veritatis voluptas voluptatibus ut. Dolor alias rem et aliquid expedita et voluptas minus. Harum quas ipsum. Tempore sunt iusto autem.,1643
asperiores beatae deleniti,false,2,Botswana,621651,300182,2020-10-12,Voluptatem aliquid accusamus earum. Commodi delectus id voluptatum veniam. Expedita debitis dicta possimus vel qui quae harum. Sint enim quos at earum quaerat dolor tempore doloribus ut. Voluptatem non tempore. Aliquam est ut sunt quaerat molestiae laudantium qui expedita cumque.,1698
ad est aliquid,false,5,Monaco,482636,350309,2021-01-23,Sit sunt unde eum. Quisquam eum enim cum. Non autem aut accusamus expedita dolorem.,1345
error eveniet aut,false,2,Aruba,621213,105967,2020-08-30,Sequi et omnis ad sunt consectetur. Eos voluptatem autem voluptatem nesciunt. At at ut inventore molestias dolores reprehenderit qui nihil. Doloremque nam quae.,593
temporibus exercitationem nisi,true,2,French Southern Territories,975227,955175,2021-03-17,Aliquid et molestias eos excepturi et. Et minima repellendus ut. Neque dignissimos distinctio blanditiis voluptatem debitis voluptatem voluptas.,1331
quis culpa expedita,true,2,Australia,41780,884949,2021-07-04,Debitis labore dolor aut aut rem. Fugiat amet ipsum ipsa asperiores. Ipsum sit ad ipsam aut dolor perspiciatis nihil. Blanditiis maxime quo commodi modi ipsa eligendi illum labore. Ipsum sed nulla ullam qui vero officiis. Molestiae et ut sint numquam et molestiae.,1812
sint consectetur doloremque,true,1,Republic of Korea,975287,825839,2021-05-29,Quia nemo voluptatibus qui numquam sint quis eum. Est rerum repellat quidem ut et facilis. Aspernatur molestiae eos consequatur dicta quasi officiis delectus. Ex ipsam blanditiis consequatur. Aut suscipit quae. Fugiat eveniet veniam fugit iusto ea illum.,193
qui libero ut,true,3,Mauritania,337839,561127,2021-04-19,Quo ullam assumenda laudantium deserunt quaerat aut sed. Qui est iure explicabo laborum. Quia praesentium cumque quam aut aut. Error ipsam numquam repudiandae eveniet sed qui. Sunt aut recusandae.,1056
nemo iusto laborum,false,4,Saint Lucia,516522,98119,2020-07-08,Ab porro esse culpa qui ab beatae qui exercitationem nostrum. Explicabo minus similique facilis sint modi laboriosam. Vitae praesentium cumque itaque provident esse inventore.,1251
ullam placeat sunt,false,1,Panama,344193,313668,2020-10-23,Magnam praesentium omnis. Hic molestias optio omnis incidunt. Quae consequatur id magni et voluptas non voluptatibus suscipit natus. Saepe possimus quisquam. Accusantium qui laboriosam odio quasi a architecto quis. Veritatis est esse odio.,395
rerum ullam voluptas,false,3,Andorra,457884,219850,2020-09-21,Beatae ea accusamus. Quia assumenda sequi blanditiis eos. Ut perferendis nisi. Quia rerum delectus omnis est quisquam. Eligendi atque accusantium.,843
eius et quae,true,5,Taiwan,540260,561888,2021-06-21,Itaque reprehenderit sit. Asperiores accusantium quia odio velit facilis quisquam cumque. Eligendi praesentium dolorum tenetur. Est voluptatum officia. Vel assumenda aut aliquam doloremque doloremque est sed.,1463
itaque aut provident,false,5,Venezuela,105470,81141,2021-03-15,Harum officia sed sapiente est voluptas velit aut sed. Ullam optio consequuntur dolorem aperiam perspiciatis aut amet. Voluptate et voluptatem minima eos libero culpa fuga.,541
autem est eum,false,2,Argentina,658893,414321,2021-06-30,Magni dignissimos qui quidem saepe ex sint dolores consequuntur asperiores. Ipsum minima aliquid et tempora dolorum modi voluptatibus eveniet. Sed autem facilis repellendus officia. Architecto quaerat aspernatur voluptates facilis accusamus necessitatibus iusto aperiam voluptatibus. Maiores dolor dolor repellendus omnis voluptatem.,347
deleniti ut veritatis,true,4,Israel,68512,327881,2021-03-13,Qui et distinctio. Ut maiores ipsum. Laboriosam nihil possimus velit odio minus nihil aut.,1585
voluptates iusto libero,true,1,Mali,419929,760374,2020-07-06,Iure eaque pariatur voluptas non quia et quisquam. Accusamus totam perferendis. Magni quae cupiditate.,1789
totam omnis aut,false,2,Angola,93965,700692,2020-11-01,Repudiandae sapiente provident ipsa enim qui perspiciatis quos. Ratione nesciunt vel consequatur quibusdam modi at ut at molestiae. Nostrum quaerat ipsum ut fugiat cupiditate.,1602
nam ut nihil,false,0,Greece,542321,386134,2020-08-24,A qui ipsa ipsam. Dolore architecto a et beatae inventore. Omnis architecto explicabo dolore enim qui exercitationem sint. Tempore voluptatem quidem velit rerum nemo saepe delectus. Iure sit repudiandae. Explicabo porro blanditiis ut.,371
omnis et occaecati,true,2,Trinidad and Tobago,670909,198870,2020-07-06,Commodi vel autem consectetur distinctio. Hic aut suscipit. Ut enim omnis omnis nam amet hic. Fuga ea quam cumque velit non excepturi reiciendis. Magnam rem culpa sint quidem et omnis iusto nesciunt.,302
laboriosam culpa minima,true,4,Angola,820225,103751,2021-05-12,Sunt aliquid totam in quia nam non hic ex repellat. Dolore sed dolores consectetur omnis reiciendis illo et quam et. Quis sint temporibus magnam eaque porro voluptas id quia voluptas. Vel aut dolorem totam nobis harum error aut quia. Perspiciatis et repellendus iure doloribus laudantium. Ut porro eos sapiente est rem mollitia sint reprehenderit.,1836
repudiandae consequatur autem,true,4,Guam,902433,665071,2020-09-27,Temporibus corrupti autem. Aut autem natus aut consectetur non facilis sunt. Ad quo mollitia harum eum in. Dolor consequatur error reiciendis et error. Vitae asperiores asperiores repudiandae unde vel tenetur fuga.,481
quis pariatur iste,true,3,Saudi Arabia,897382,265394,2021-06-01,Et qui sit fuga libero impedit harum minus. Tempora sed nesciunt odit soluta iste consequuntur est eos. Nostrum exercitationem ratione qui fugiat quae consequuntur sint dignissimos est. Dolorem quod consequatur aut impedit nobis iste sint ex. Est facere laborum sint.,9
et quo ea,true,3,Gambia,474897,49246,2020-11-24,Sunt et nihil incidunt voluptatibus qui ut. Architecto sint esse asperiores tempora magni. Dolores voluptas veritatis voluptatem. Molestiae explicabo beatae expedita repellendus et expedita quia corporis. Asperiores necessitatibus facere enim quia nostrum sed nam debitis fugiat. Qui quasi quae et aut et sed minus iusto.,441
eaque nulla temporibus,false,4,Paraguay,862997,294506,2021-01-25,Consectetur ut ipsa quo rem aspernatur enim quia. Quis quod ad labore aut qui quia fugiat quia. Et mollitia necessitatibus unde ea.,1432
animi voluptatem ut,true,0,Lesotho,376370,834167,2020-09-07,Odio beatae sunt. Voluptatem quidem dolor. Provident eaque fugit enim natus suscipit error placeat. Voluptatibus qui porro. Aspernatur quod praesentium eos eveniet. Ullam soluta quam quia perspiciatis reiciendis veritatis rerum ea et.,802
sit omnis eos,false,4,Kiribati,400439,289544,2021-04-03,Adipisci sit in dignissimos et hic rerum nulla. Rem rerum quibusdam consequuntur totam. Autem et et est et voluptas et eum blanditiis et. Rerum recusandae quod iure asperiores excepturi omnis repudiandae quisquam.,803
veniam quia eaque,true,1,Hong Kong,952221,336450,2021-01-31,Praesentium saepe ex. Magnam et iusto nesciunt voluptatem quasi iste maxime doloribus. Eum consequatur voluptatem fuga in minus sed officia. Ea quod quia.,1276
consequuntur assumenda qui,true,5,Honduras,59999,686413,2021-03-31,Soluta maiores ut voluptatem itaque sed debitis. Enim exercitationem ex mollitia voluptas impedit consequatur sed. Ullam ex earum aut tempore perspiciatis voluptates voluptatem sit fugiat. Architecto eius provident. Voluptas consequatur doloremque laboriosam rem sunt voluptate voluptas quo. Molestiae voluptatibus distinctio adipisci enim sit reprehenderit dignissimos.,804
