title,abuseReported,rating,location_,userid,productid,reviewDate,reviewBody,helpfulCount
ipsum autem voluptatibus,false,2,Lesotho,470641,355393,2021-06-15,Inventore voluptatum cumque est perspiciatis qui quae ut debitis est. Rerum non sunt non ut qui velit sunt. Perspiciatis aspernatur aut ut rem error culpa laudantium recusandae. Voluptas vitae omnis sint voluptas ut. Inventore quia consectetur quia quod libero autem.,1888
quia facere quo,true,1,Macedonia,987863,474745,2021-06-13,Molestiae libero quia minima qui. In voluptatem est ipsa necessitatibus consequuntur unde. Et recusandae aspernatur necessitatibus esse ea esse dolorum est.,216
totam reprehenderit eius,true,5,Heard Island and McDonald Islands,937370,904574,2021-01-19,Dolor voluptate quisquam et aut alias aut voluptas soluta eos. Eum aut consequatur et enim nesciunt ullam voluptatibus eos impedit. Ea accusantium atque ea animi deserunt voluptatem. Rerum dolores qui.,671
perferendis velit itaque,false,3,United States of America,554063,650747,2021-07-01,Corporis quia dolorum. Sed sint consectetur sint et eum nihil. Recusandae quam quis voluptatem rerum non. Impedit delectus dignissimos quaerat cupiditate assumenda et ea. Iusto suscipit maiores. Qui adipisci ut dolorum dignissimos voluptatem dolore aspernatur.,1875
provident minus minima,false,2,Saudi Arabia,637737,693769,2021-06-18,Nulla labore et voluptas. Aperiam numquam ducimus. Voluptatum magni recusandae quaerat voluptatem nam laborum. Ut expedita iure nulla. Iusto debitis aut corporis. Consequatur omnis quasi est dolorum repellendus porro et.,1937
optio nostrum minus,true,1,Cambodia,81783,782656,2020-07-16,Voluptas doloribus repellat. Nemo harum et. Exercitationem quibusdam accusamus.,947
officiis iusto quis,false,1,Thailand,803076,705032,2021-05-07,Ex tenetur nobis qui ut dolore. Nam quod dolor distinctio quaerat aliquam et consequatur qui vel. Vel enim soluta dolorem facilis distinctio omnis dolorem maxime. Porro omnis dignissimos est atque qui fuga.,1758
vero rerum et,false,0,Benin,392241,732584,2020-12-02,Pariatur quia sapiente sunt esse. Eum aliquid praesentium quia. Rerum ea molestiae tempora consequatur. Aut in vitae et. Dolores iste quibusdam ullam quibusdam.,1803
voluptatem id et,true,5,Lithuania,239161,633843,2020-09-02,Non repellendus alias voluptas. Natus at molestiae molestias adipisci et neque corrupti est. Dolor aut eius exercitationem dolores aspernatur earum occaecati eveniet explicabo. Mollitia ex ipsum.,364
eius cupiditate sint,false,2,Tajikistan,831756,858326,2021-06-13,Dignissimos accusamus esse ut. Molestias ipsa ut. Distinctio voluptatem earum eos ducimus aliquam quibusdam nam nostrum repellat. Sunt non possimus et dolorem vel recusandae voluptatum aut. Laboriosam sunt et et. Ea distinctio voluptas illo occaecati hic incidunt voluptates aperiam veritatis.,1450
nam explicabo aut,false,1,Singapore,337014,912318,2021-06-14,Consequuntur adipisci ducimus sed nesciunt illum. Quibusdam ipsum ipsum dolore nobis ut repellendus eveniet eligendi cumque. Maiores repellat nisi deleniti optio quae qui ea. Facilis voluptates ea et expedita eligendi ut molestias voluptatum aliquid. Enim in doloremque dignissimos. Unde officia non sit nisi vitae consequatur dolorum mollitia.,1951
perspiciatis at neque,true,3,Bermuda,709685,364500,2021-02-17,Unde et vero quo nisi nulla eius modi. Sit et magni labore molestiae. Autem numquam et. Aperiam at ea et omnis autem. Rerum dolores quas sed. Nostrum blanditiis aut reiciendis exercitationem.,319
rerum aut quo,false,5,Costa Rica,958257,357785,2020-08-10,Consequatur repudiandae necessitatibus optio voluptatem voluptatem accusantium cupiditate et. Dolorem numquam quia et id neque quasi molestiae. Vel voluptatibus fugiat officia.,1557
numquam ut unde,true,1,Uruguay,219514,933826,2021-04-01,Cum dicta velit beatae nihil quam delectus vero. Nesciunt sit ipsam sint expedita veniam voluptatum. Et rerum modi doloremque. Consequuntur et unde et. Velit aliquid harum quae voluptatem illum laudantium.,144
molestiae at alias,true,0,Christmas Island,189455,189085,2021-03-14,Earum vero sed qui nihil et minima. Veniam cumque et libero et incidunt. Eaque dolores amet earum. Cupiditate dignissimos ipsa. Ex id dolor sed. Et et cum.,839
omnis perspiciatis doloribus,true,0,India,311393,161341,2021-06-13,Ab et impedit at eligendi optio ab hic. Et et labore dolor. Odit eos adipisci maiores aut aut quo. Atque magni quam voluptatem autem et fuga.,1968
quibusdam doloribus tempore,false,3,Lebanon,43496,66878,2020-12-16,Ullam accusamus facilis autem nihil tempore molestiae accusamus sit. Nam provident voluptatem sit. Molestiae perspiciatis officiis animi qui. Dolores laboriosam placeat quo veritatis voluptatem aut quis. Et minima beatae.,1961
non ut numquam,true,2,Tokelau,338299,67980,2020-07-19,Consectetur explicabo ipsam ducimus. Ratione veniam rerum quam modi blanditiis quia asperiores. Id nobis eius. Possimus omnis nam ut commodi consequuntur vel nostrum mollitia. Inventore quasi ipsum nisi est distinctio eum.,923
perferendis nam nulla,false,2,Cape Verde,87619,6633,2021-06-08,Quia quam quae natus recusandae. Itaque molestias deserunt qui eos molestiae et. Voluptatem aperiam voluptatem voluptas architecto consequatur. Mollitia vero aut. Voluptatem aut error qui debitis qui ut tempore deleniti.,1987
fuga omnis dolorem,true,1,Saint Kitts and Nevis,561680,301305,2021-02-07,Mollitia quos exercitationem qui dolor et dolore. Dolores a consequatur reiciendis qui labore eligendi molestiae. Consequatur placeat quis ea vero fuga. Suscipit nesciunt et eveniet tenetur in quae fugiat cumque aspernatur. Aliquid molestiae non in eos suscipit reiciendis sed ducimus officia. Iusto est ea.,289
numquam harum dolorem,false,1,Cape Verde,513585,712192,2021-03-06,Aut laboriosam quia quis tempora voluptatem ut aspernatur qui sed. Ut ipsam et quia fugiat modi commodi reprehenderit ratione. Eaque repudiandae beatae odio rerum ut. Facere nostrum natus facere sint. Velit aut pariatur. Asperiores soluta et asperiores odio sapiente consequatur.,1160
omnis quasi reiciendis,true,2,United Kingdom,348509,146710,2021-02-26,Odit necessitatibus ut tempore aut repellat at. Error dolorem aut nemo quia dolor voluptates aut nobis quia. Eos fugiat ea exercitationem quis rerum. Omnis vitae sed id voluptatem dolores aut distinctio ipsam. Id quia officia. Quasi perspiciatis consectetur accusamus debitis impedit totam inventore consectetur.,1964
eum suscipit adipisci,true,0,Sweden,158682,20754,2020-07-07,Sequi natus rem asperiores. Voluptatem itaque voluptatem. Voluptatem error molestiae qui aut consequuntur similique exercitationem. Ut ut dignissimos velit.,1504
pariatur iusto quo,false,5,Philippines,164406,478055,2021-04-01,Et excepturi aliquid. Odit odio et optio ea consequatur ipsa. Quidem recusandae rerum quis nostrum voluptates enim maiores ut optio. Ut impedit repellat qui sed in eos architecto quis.,1452
aliquid et eum,false,3,Virgin Islands British,788156,688816,2020-10-09,Accusamus sit nemo sint deleniti facilis sit at. Vero est ipsa et. Temporibus cum est consectetur et reprehenderit harum. Laborum et omnis voluptatem iusto molestias nobis culpa iusto quisquam. Harum autem beatae aut ut accusantium impedit. Dolore enim recusandae et quis saepe perspiciatis porro aut velit.,1118
aut ipsa molestiae,true,4,Svalbard & Jan Mayen Islands,425706,224561,2021-04-30,Veniam ut et nulla omnis voluptas. Porro pariatur eaque omnis. Quas impedit nisi dolores. Explicabo dolorum repudiandae debitis beatae quos. Non laboriosam mollitia et sed voluptas. Non ut ut unde.,1289
est tempora ullam,false,1,Lao People's Democratic Republic,176807,523748,2021-04-17,Quis et recusandae soluta veniam aut voluptas. Cupiditate at et. Hic voluptatem et. Distinctio illo voluptates illo deleniti deserunt provident qui. Sequi amet in iusto labore incidunt possimus quia sit reiciendis.,1337
saepe reiciendis vitae,true,3,Tanzania,892706,570863,2020-10-03,Ut sint similique libero nesciunt enim sunt quasi quia. Illum culpa aut enim qui natus laboriosam error et. Qui dolores accusamus non ea impedit quis et.,1503
nemo sequi corporis,false,4,Dominica,336333,555713,2021-04-18,Sint amet consequatur cum corporis ea quas non. Totam et perferendis voluptas. Vitae nostrum consequatur magni aut quam. Sapiente corrupti sint quos. Autem molestias voluptatem.,279
voluptatibus enim magni,true,1,Lebanon,685541,416237,2021-01-27,Et et quia hic eligendi eveniet ipsam enim temporibus assumenda. Nostrum praesentium sed et et doloremque ullam soluta non doloribus. Distinctio est cumque ullam.,423
dolore iure odit,false,3,Lesotho,742242,612915,2020-10-25,Sit minima sint. Repudiandae omnis ut non voluptatem iste in adipisci inventore pariatur. Eius nihil maiores ut ea rerum quas dolor voluptatum ut. Consectetur molestias qui ut id quod. Rerum fugiat tenetur praesentium.,600
incidunt quas excepturi,false,0,France,560482,185929,2020-11-02,Placeat totam et consequatur veritatis dignissimos dolores quaerat. Ullam corrupti molestias sunt. Voluptatem quia quidem adipisci sed perferendis aperiam aperiam.,1736
et quia dolor,true,4,Cameroon,517193,20708,2020-12-15,Eaque natus eveniet doloremque fugit culpa. Rerum qui eos quis. Aut error non consequatur qui natus quis qui. Aut consequatur molestiae eaque repudiandae minima. Corrupti et occaecati molestias facilis illo officia.,1105
est tempore temporibus,true,0,Burundi,855729,672749,2020-09-17,Error accusamus est veritatis. Cupiditate sed rerum laborum commodi nobis ut non. Maxime atque et sit et. Consequuntur ea porro ipsa. Aut qui non vel.,1734
nostrum similique esse,true,1,Costa Rica,353171,956794,2020-09-28,Molestiae mollitia voluptatem. Ea non a voluptas blanditiis. Sed non magni rerum non pariatur provident facilis. Itaque nihil maiores qui qui repellendus vel. Non voluptatem maiores animi pariatur.,797
animi et earum,false,5,Cape Verde,177766,543298,2021-01-22,Et rerum eaque ullam qui et unde. Quidem labore ea sit eum aperiam porro reiciendis dolores omnis. Dignissimos officia magnam.,1790
cupiditate velit vel,false,1,Rwanda,214024,757147,2021-05-14,Debitis quia quaerat quo tenetur. Ab et eveniet excepturi ipsa vel sint accusamus quas quae. Quidem quibusdam sit esse unde rerum quia nam ea tenetur. Quia eius quia modi odit.,1136
mollitia aperiam tempore,true,0,Chad,419962,691716,2021-05-15,Iste suscipit repellendus et doloribus magnam nihil praesentium. In hic consequuntur debitis saepe quas. Molestias quidem adipisci beatae. Dolor quae enim tempora sunt omnis natus ipsa. Pariatur modi aut similique.,505
deserunt veniam iusto,true,5,Lithuania,960579,928658,2020-11-05,In voluptatem provident voluptatem maiores ullam placeat. Pariatur autem voluptas et inventore vel dolorem ab rem fuga. Maiores unde maxime soluta vero aliquam iusto. Libero minus esse suscipit aliquam. Aperiam facilis nobis nesciunt est harum quo qui.,1407
enim quae mollitia,false,2,Denmark,786629,950487,2020-10-07,Consequatur optio rerum illum aliquam. Tempora sunt nobis blanditiis omnis laborum laudantium ex reiciendis. Eos sapiente totam quia est neque minima aliquam commodi. Et voluptas commodi optio modi fugiat.,1644
totam eos sint,false,5,Vanuatu,413398,226034,2020-07-07,Aut aut quod eveniet officia aliquam doloribus. Mollitia et ducimus ipsum neque nesciunt et quam omnis. In iure quas nostrum ab ut neque. Et nihil quo occaecati distinctio. Ullam cupiditate molestiae aut.,773
modi cupiditate enim,true,0,Liberia,424385,458931,2021-05-14,Et ad est. Quia hic aperiam in est ex reprehenderit et consequatur minus. Porro quam est nulla voluptatem aut eos. Voluptatum voluptatem atque et. Illum ullam sint eum soluta porro dolor sed commodi quia. Ipsum officia inventore sunt rem voluptates aperiam.,967
blanditiis ut ab,true,4,Peru,865695,530791,2021-04-19,Architecto fuga quae error. Accusantium doloremque voluptatem omnis architecto officiis similique similique. Consequatur delectus optio id impedit repudiandae nostrum voluptas natus. Explicabo sed modi nihil fugit voluptatibus et accusamus veritatis id. Perferendis voluptatem reiciendis eum. Reiciendis eos placeat cumque ut perferendis dolor qui.,1579
aliquid sit quo,true,0,Gibraltar,262153,427259,2021-01-09,Ipsum aperiam ut quia corrupti. Recusandae architecto reiciendis. A ipsum possimus qui. Molestias perspiciatis quia ut.,239
quia cum sit,false,4,Uzbekistan,576643,10726,2021-07-03,Cum quia quia suscipit beatae. Est beatae ipsam earum aspernatur maiores sed et in. Omnis voluptatem error aut et tempore doloribus ipsam aut et. Sit illum ut libero voluptate odio quasi occaecati dignissimos.,1092
debitis aliquam et,true,5,Syrian Arab Republic,30847,223842,2021-07-03,Qui sint explicabo ut. Eaque inventore occaecati doloribus et magni est cupiditate. Omnis pariatur facilis asperiores est expedita nesciunt quasi dignissimos tempora.,687
facere consectetur deleniti,true,1,Pakistan,115803,375358,2021-02-08,Magni quibusdam amet distinctio vitae. Quidem voluptas ut sit eos numquam dolores. Consequatur velit consequatur.,943
vero nostrum impedit,true,4,Holy See (Vatican City State),179912,97638,2021-06-14,Velit veritatis maxime aut vel repudiandae odit delectus. Sed soluta sit. Sunt perspiciatis accusantium quis ut quia voluptatibus voluptates.,728
nihil architecto similique,false,4,Burkina Faso,273535,717456,2020-07-14,Eveniet nostrum reprehenderit delectus sit consequatur aut. Facilis corporis qui vel ea consectetur. Deleniti non fugiat sed vel. Explicabo et totam nam dolorem asperiores totam vel rem nobis. Consequuntur repellat fuga. Non aut eaque dicta aut distinctio modi est.,1691
deleniti quos accusantium,false,3,Japan,744093,222135,2021-03-15,Enim sit eum dolor sunt nisi. Sint consequuntur maxime tenetur natus id vitae a dolor eligendi. Odio occaecati aut mollitia culpa dicta non et dolores expedita. Impedit necessitatibus qui temporibus ipsa cumque corrupti. Nihil omnis culpa dolorem. Et iste repellendus cupiditate.,696
maiores consequatur consectetur,true,5,Argentina,407271,721756,2020-10-27,Id delectus alias est tempore et animi dignissimos sunt ut. Impedit et sunt et deleniti in natus ab rerum nulla. Facilis maiores consequuntur quia alias deleniti quia qui nobis nisi. Velit nobis est et distinctio rerum.,1997
ducimus sed minima,false,5,Gambia,197014,616277,2021-05-09,Autem et eos sunt nulla eum deserunt. Repudiandae totam qui labore voluptas neque soluta sed at et. Voluptatem alias voluptates. Quia temporibus aut voluptas repellendus.,792
sit eligendi facilis,false,2,Congo,607294,247197,2020-12-19,Mollitia dolores officiis voluptates fuga. Id quo est praesentium fugiat rerum tempore. Sunt voluptates molestiae cum excepturi dicta unde dolores. Harum maiores dolorum id consequuntur ullam error nemo voluptatem. Molestias laudantium iste expedita et quo.,307
qui modi eius,true,4,Czech Republic,187934,886920,2020-09-15,Praesentium placeat repudiandae et et non iste. Omnis quo doloremque. A dolorem et.,14
sit id magni,true,0,United States Minor Outlying Islands,99266,25475,2020-07-12,Et sed nisi enim soluta qui dicta facilis. Quod ea eaque. Et hic in sit. Porro similique nostrum temporibus et architecto enim.,585
inventore id rerum,true,1,Namibia,729509,337533,2021-02-06,Aperiam eum labore vitae aut qui. Perferendis nihil quas. Alias accusantium ullam ut qui aperiam eligendi dolores. Eos doloribus dolorum et illum nisi illum. Modi veniam modi deleniti et dicta vitae. Sed ducimus nihil.,1601
nihil corrupti iusto,true,5,Eritrea,807742,211920,2020-11-12,Aut molestiae provident itaque. Quo qui eum qui aut et explicabo. Tempore dignissimos et odit sapiente dignissimos repudiandae nam. Labore accusantium consequatur dicta quia. Excepturi dolorum officiis aliquid ducimus nemo voluptatem. Animi tempore veritatis hic incidunt.,1914
recusandae dolorem ut,true,4,Pakistan,927443,100860,2020-07-30,Occaecati eligendi porro sit sed consequatur sint. Fugiat accusantium odio. Enim qui nam repellat et corporis velit. Ut ut alias eveniet rerum ab. Omnis ut nemo ut rem omnis ad recusandae est. Inventore quisquam repudiandae et.,567
voluptates vel omnis,false,3,Marshall Islands,478865,906548,2020-11-21,Odit tenetur doloremque fugiat dolores quasi id dolores. Quam nesciunt maiores tenetur. Beatae minus corporis maxime rerum sunt. Asperiores officiis laudantium consequuntur molestiae natus eos vero ab.,1276
voluptatem quia tempore,true,3,Pakistan,231250,809447,2020-07-10,Recusandae voluptatibus rerum ut laudantium ut exercitationem quis. Ut vero dolor voluptatum. Non sit molestiae soluta aut. Dolore assumenda dignissimos libero eum aspernatur commodi id magnam excepturi.,725
rem quibusdam fugiat,false,1,Luxembourg,256554,475153,2020-09-27,Autem dignissimos alias. Quia ullam expedita et et corrupti voluptatem harum. Quod minima quis. Aperiam facilis ab expedita quia ipsum et ut.,1572
dolore velit tenetur,false,3,Spain,23490,658179,2021-03-04,Magnam dolore at est excepturi. Non nihil quia aperiam animi quisquam. Corporis molestiae placeat porro praesentium.,978
amet sint earum,false,3,Norway,575983,120463,2020-12-14,Est et consequuntur similique sit sunt quod. Est ducimus est asperiores deserunt in minus dolores. Laudantium consequuntur officia. Praesentium dolor praesentium veniam blanditiis.,1008
optio nobis ducimus,false,1,Qatar,686228,844799,2020-07-26,Placeat natus vel sunt. Quaerat doloribus reiciendis earum sint similique aliquam. Quo quasi necessitatibus velit architecto sed. Enim quasi qui modi voluptas et autem ut et. Eligendi eius deserunt ex debitis non.,1421
neque at minus,true,3,Pakistan,921653,113244,2021-01-11,Maiores quis nobis deleniti fugit. Optio aspernatur enim. Molestias et magnam molestiae unde velit id accusamus voluptas. Non optio corporis quis autem ipsam iste.,1199
perferendis natus molestiae,false,2,Switzerland,402842,958151,2020-08-16,Delectus ut omnis quod sit praesentium. Consequatur ullam voluptas impedit iusto. Odio dolor ea pariatur quis beatae aliquam ut. Sit sapiente quos placeat blanditiis et aperiam placeat laudantium alias. A minima mollitia possimus.,1306
et commodi aliquid,true,4,Oman,871569,610587,2021-02-27,Debitis in inventore eos sequi amet perferendis. Laudantium dolorem magnam. Iste minus qui illum voluptas sunt totam necessitatibus ea. Ex qui sed.,1221
est aliquid quisquam,false,0,Ukraine,811821,718071,2021-01-20,Tempora hic ratione dolores perspiciatis repellat maiores et est. Facere porro aut est. Labore maxime quod. Soluta quia labore. Est quam qui nam et quasi voluptates ut et sequi.,1884
sint doloribus rerum,true,0,French Polynesia,823625,557455,2020-11-20,Odit similique enim rerum. Aut et commodi porro itaque atque id natus aperiam. Voluptatum aliquid explicabo molestiae harum et provident ipsa.,229
adipisci cumque et,true,1,Guadeloupe,784151,480464,2021-01-30,Explicabo ea sint non maiores ut odit quia. Est pariatur sunt eum cupiditate deleniti fugit exercitationem. Repellat soluta suscipit laborum fugit hic.,440
quod cum quia,false,0,Grenada,644645,39733,2021-03-08,Commodi vel nemo quas. Ducimus blanditiis neque voluptatem nihil et veritatis vel consequatur. Delectus reiciendis accusantium repudiandae similique et iure. Enim consequatur enim ut. Vel quo qui incidunt est cupiditate itaque aspernatur nisi explicabo. Amet velit voluptas possimus.,1039
aspernatur rerum vero,true,3,Serbia,813781,842258,2020-09-14,Deserunt neque et aut voluptas culpa enim adipisci placeat. Facilis libero aperiam in rem quisquam velit. Voluptatem esse omnis quia fuga accusantium aut amet. Aut voluptatum quidem reiciendis porro. Sequi facilis eos aut ut. Nam quo aliquam.,1394
impedit repellendus explicabo,true,5,British Indian Ocean Territory (Chagos Archipelago),432472,958954,2020-10-26,Doloremque vitae aperiam tempore sed nihil quod dolor qui. Veritatis et repudiandae cumque sunt. Consequatur architecto unde iste similique neque. Dolores ducimus voluptates consequuntur. Ut eligendi harum quis reprehenderit sequi fugiat.,1333
velit laboriosam inventore,false,3,Poland,352705,294662,2020-09-26,Consequatur impedit ducimus ea. Molestiae asperiores reprehenderit. Nesciunt ut corporis iste.,1519
qui omnis eum,true,1,French Polynesia,500116,452013,2021-05-08,Reiciendis id sint quod eligendi minima dolorum repellendus et. Nemo ad eveniet unde. Ratione cum sit deserunt. Praesentium minima tempore ducimus. Qui et saepe modi. Aspernatur quisquam non.,1965
id quod dolorum,true,3,Mozambique,692103,98641,2021-04-12,Impedit quae aut reprehenderit non consequatur et. Id fuga qui facilis et sapiente ea. Quo itaque dolore dolorum ratione sunt neque commodi quia. Nisi voluptatem veritatis veritatis.,1637
enim odit eos,true,2,Zambia,395304,956753,2021-01-15,Corrupti non aperiam est et cupiditate dolore. Error maxime voluptate nisi aliquam sint. Magnam modi nisi. Sit omnis optio animi molestiae. Ratione ut voluptatem. Aut error et id porro hic eius sequi officia aliquid.,1737
minima quis facilis,true,3,Denmark,406800,589693,2020-09-15,Sunt et animi voluptatem autem voluptatem. Aut debitis alias fuga repellendus et aut. Nobis occaecati ratione quas. Ea autem ea et natus. Eum veniam repellat qui dolores et dolorem assumenda. Sed dolorem sunt ab qui ipsum doloremque enim repudiandae voluptas.,12
eligendi sapiente repudiandae,false,2,Gibraltar,607224,396474,2021-04-17,Sunt aut aliquid nihil qui. Est odit reiciendis quisquam voluptatibus. Provident corporis nisi minima corrupti inventore omnis nihil. Est a placeat excepturi suscipit ex modi sint. Facilis praesentium a voluptatibus sunt quam. Enim aliquam et exercitationem aut voluptate.,1282
tenetur voluptatem non,true,0,Swaziland,915099,444856,2021-06-21,Ut voluptatem nam veritatis hic nemo eos molestiae numquam distinctio. Exercitationem optio aut est sunt sed placeat porro ducimus quibusdam. Debitis aut consequatur est modi voluptatibus officiis qui. Tempore rerum velit id nostrum nemo ut deleniti consequatur. Veritatis non totam alias repellat aut optio aspernatur.,940
libero et dolorem,false,0,South Georgia and the South Sandwich Islands,622766,238578,2021-04-11,Eius nisi autem optio et sed quis sed. Cupiditate neque rerum. Dolorem ut aspernatur totam maxime. Iusto eum ratione illo.,1626
eius enim architecto,true,2,Russian Federation,562925,807003,2020-08-28,Est quia magnam debitis architecto. Cumque itaque iure quia ipsam voluptates accusamus. Laboriosam ipsum iure earum reiciendis dolores ut. Perferendis officia aut illum et quia.,144
ut culpa quam,false,0,Maldives,221900,729574,2021-03-22,Consequuntur maxime vero voluptatem minima. Voluptate sint neque non natus atque qui. Odio cumque iusto quo earum voluptas ducimus neque aut atque. Alias modi dolorem omnis necessitatibus. Ea sunt autem earum.,578
voluptatibus reiciendis tenetur,false,0,Guyana,215353,749702,2020-07-24,Nostrum voluptatibus saepe fuga reprehenderit sit ipsum voluptatem est error. Consequatur odio quidem ut omnis quibusdam corporis. Ad nisi cum voluptatem fugit architecto repellendus fugit. Illum iusto dolorum et. Et quo fugiat. Soluta suscipit quia incidunt necessitatibus corrupti quia nobis consequatur molestiae.,1810
sint ea sequi,true,3,Lesotho,321345,484050,2020-08-07,Voluptatem totam dolore ut tenetur. Alias dolores tenetur consectetur deleniti fugiat occaecati iste. At ea eos quia sint dignissimos alias nihil qui. Eum dolores quia tempore minima non. Eos voluptates dignissimos non esse tempore sapiente. Modi autem voluptatem ducimus deleniti ea.,871
esse sequi consequuntur,true,4,Saudi Arabia,908090,326118,2021-03-13,Quas asperiores quia necessitatibus aut voluptas. Eveniet quod aliquid doloremque et. Optio sed officia. Facere nemo ratione eos. Impedit non quos et.,1834
dignissimos natus consequatur,false,0,Colombia,313818,332745,2021-06-04,Repellat excepturi ipsam illum rerum qui distinctio mollitia maxime est. Iure nemo sint. Occaecati reprehenderit totam mollitia sit sint odio consequatur dolorem. Pariatur alias et. Provident et quae veritatis quos explicabo. Sequi alias perferendis at facere.,1909
libero ut illo,false,3,Syrian Arab Republic,409970,866300,2020-07-21,Enim mollitia dolorem quod. Aut saepe qui. Et omnis sint officiis culpa aut iure aut corporis in. Distinctio debitis architecto similique ut tenetur nesciunt. Quia modi ea quidem veniam rerum rerum iusto aut.,1016
itaque aut vel,true,1,Eritrea,372746,706317,2020-07-31,Ab odio et ipsam totam dolores nisi ratione. Enim consequatur sunt nobis aut sint praesentium. Explicabo quia excepturi dolores aliquam iste facilis. Omnis distinctio maxime et. Ea quaerat eveniet non.,1988
hic iste perferendis,false,2,Tunisia,987253,135814,2021-05-31,Laudantium minima nobis laboriosam ut sint consequuntur. Et blanditiis est assumenda praesentium molestias ipsa labore. Mollitia sed illo cumque eius quod consectetur repellat neque praesentium. Sunt quis eius nisi perspiciatis eum. Similique perferendis consequatur molestiae mollitia labore officia eveniet ipsum.,443
omnis harum mollitia,false,5,Kazakhstan,692890,844491,2021-03-06,Voluptas voluptatibus qui dolorum. Dolorum numquam pariatur expedita dolorem iure. Eius quas tempora consequatur aut sint quis sint error possimus. Dolore non itaque laboriosam delectus quam. Quia ad eligendi harum consequatur. Sit enim veniam alias dicta.,1322
iusto tempore facilis,true,1,Martinique,656942,931978,2020-10-23,Unde omnis expedita nihil maiores nesciunt doloribus perspiciatis nisi. Magnam ut natus sed velit quasi fugiat est. Non suscipit eos necessitatibus. Sint dolores dolores neque maiores. Nemo tenetur delectus. Quia esse nulla voluptatem est debitis.,1039
aliquid delectus recusandae,false,3,Niger,414966,587043,2020-09-22,Inventore voluptate recusandae. Est iusto nostrum ut magnam numquam et est quia. Odit provident et fuga sunt dignissimos. Facilis soluta dolores. Quaerat aliquam perferendis dicta molestiae id in reprehenderit.,576
